{
  "$schema": "http://json-schema.org/draft-07/schema#",
  "title": "Gym[]",
  "type": "array",
  "description": "Array of Gym entities. One PR = one new item appended, or one file in the per-entity directory.",
  "items": {
    "title": "Gym",
    "type": "object",
    "additionalProperties": false,
    "properties": {
      "createdAt": {
        "type": "string",
        "format": "date-time"
      },
      "createdBy": {
        "type": [
          "null",
          "string"
        ]
      },
      "updatedAt": {
        "type": [
          "null",
          "string"
        ],
        "format": "date-time"
      },
      "updatedBy": {
        "type": [
          "null",
          "string"
        ]
      },
      "id": {
        "type": "string"
      },
      "name": {
        "type": "string"
      },
      "description": {
        "type": [
          "null",
          "string"
        ]
      },
      "status": {
        "$ref": "#/items/definitions/GymStatus"
      },
      "county": {
        "$ref": "#/items/definitions/County"
      },
      "affiliation": {
        "oneOf": [
          {
            "type": "null"
          },
          {
            "$ref": "#/items/definitions/Affiliation"
          }
        ]
      },
      "trialOffer": {
        "$ref": "#/items/definitions/TrialOffer"
      },
      "location": {
        "$ref": "#/items/definitions/Location"
      },
      "socialMedia": {
        "$ref": "#/items/definitions/SocialMedia"
      },
      "offeredClasses": {
        "type": "array",
        "items": {
          "$ref": "#/items/definitions/ClassCategory"
        }
      },
      "website": {
        "type": [
          "null",
          "string"
        ]
      },
      "timetableUrl": {
        "type": [
          "null",
          "string"
        ]
      },
      "imageUrl": {
        "type": [
          "null",
          "string"
        ]
      }
    },
    "definitions": {
      "GymStatus": {
        "type": "string",
        "description": "",
        "x-enumFlags": true,
        "x-enumNames": [
          "None",
          "Active",
          "PendingApproval",
          "TemporarilyClosed",
          "PermanentlyClosed",
          "OpeningSoon",
          "Draft",
          "Rejected"
        ],
        "enum": [
          "None",
          "Active",
          "PendingApproval",
          "TemporarilyClosed",
          "PermanentlyClosed",
          "OpeningSoon",
          "Draft",
          "Rejected"
        ]
      },
      "County": {
        "type": "string",
        "description": "",
        "x-enumNames": [
          "None",
          "Carlow",
          "Cavan",
          "Clare",
          "Cork",
          "Donegal",
          "Dublin",
          "Galway",
          "Kerry",
          "Kildare",
          "Kilkenny",
          "Laois",
          "Leitrim",
          "Limerick",
          "Longford",
          "Louth",
          "Mayo",
          "Meath",
          "Monaghan",
          "Offaly",
          "Roscommon",
          "Sligo",
          "Tipperary",
          "Waterford",
          "Westmeath",
          "Wexford",
          "Wicklow",
          "Antrim",
          "Armagh",
          "Derry",
          "Down",
          "Fermanagh",
          "Tyrone"
        ],
        "enum": [
          "None",
          "Carlow",
          "Cavan",
          "Clare",
          "Cork",
          "Donegal",
          "Dublin",
          "Galway",
          "Kerry",
          "Kildare",
          "Kilkenny",
          "Laois",
          "Leitrim",
          "Limerick",
          "Longford",
          "Louth",
          "Mayo",
          "Meath",
          "Monaghan",
          "Offaly",
          "Roscommon",
          "Sligo",
          "Tipperary",
          "Waterford",
          "Westmeath",
          "Wexford",
          "Wicklow",
          "Antrim",
          "Armagh",
          "Derry",
          "Down",
          "Fermanagh",
          "Tyrone"
        ]
      },
      "Affiliation": {
        "type": "object",
        "additionalProperties": false,
        "properties": {
          "name": {
            "type": "string"
          },
          "website": {
            "type": [
              "null",
              "string"
            ]
          }
        }
      },
      "TrialOffer": {
        "type": "object",
        "additionalProperties": false,
        "properties": {
          "isAvailable": {
            "type": "boolean"
          },
          "freeClasses": {
            "type": [
              "integer",
              "null"
            ],
            "format": "int32"
          },
          "freeDays": {
            "type": [
              "integer",
              "null"
            ],
            "format": "int32"
          },
          "notes": {
            "type": [
              "null",
              "string"
            ]
          }
        }
      },
      "Location": {
        "type": "object",
        "additionalProperties": false,
        "properties": {
          "address": {
            "type": "string"
          },
          "venue": {
            "type": "string"
          },
          "coordinates": {
            "$ref": "#/items/definitions/GeoCoordinates"
          }
        }
      },
      "GeoCoordinates": {
        "type": "object",
        "additionalProperties": false,
        "properties": {
          "type": {
            "type": "string"
          },
          "coordinates": {
            "type": "array",
            "items": {
              "type": "number",
              "format": "double"
            }
          },
          "placeName": {
            "type": [
              "null",
              "string"
            ]
          },
          "placeId": {
            "type": [
              "null",
              "string"
            ]
          }
        }
      },
      "SocialMedia": {
        "type": "object",
        "additionalProperties": false,
        "properties": {
          "instagram": {
            "type": [
              "null",
              "string"
            ]
          },
          "facebook": {
            "type": [
              "null",
              "string"
            ]
          },
          "x": {
            "type": [
              "null",
              "string"
            ]
          },
          "youTube": {
            "type": [
              "null",
              "string"
            ]
          }
        }
      },
      "ClassCategory": {
        "type": "string",
        "description": "",
        "x-enumNames": [
          "Uncategorized",
          "BJJGiAllLevels",
          "BJJNoGiAllLevels",
          "WomensOnly",
          "Wrestling",
          "MuayThai",
          "Boxing",
          "StrengthTraining",
          "YogaOrPilates",
          "KidsBJJ",
          "BJJGiFundamentals",
          "BJJGiAdvanced",
          "BJJNoGiFundamentals",
          "BJJNoGiAdvanced",
          "CompetitionTraining",
          "ProTraining",
          "Other"
        ],
        "enum": [
          "Uncategorized",
          "BJJGiAllLevels",
          "BJJNoGiAllLevels",
          "WomensOnly",
          "Wrestling",
          "MuayThai",
          "Boxing",
          "StrengthTraining",
          "YogaOrPilates",
          "KidsBJJ",
          "BJJGiFundamentals",
          "BJJGiAdvanced",
          "BJJNoGiFundamentals",
          "BJJNoGiAdvanced",
          "CompetitionTraining",
          "ProTraining",
          "Other"
        ]
      }
    }
  }
}